{
  "$schema": "https://json-schema.org/draft/2020-12/schema",
  "$id": "https://kickxkick.local/schema/proposal.schema.json",
  "title": "KickxKick Data Proposal",
  "type": "object",
  "required": ["version", "createdAt", "scope", "status", "brands", "models", "aliases", "searchKeywords", "audit"],
  "additionalProperties": false,
  "properties": {
    "version": {"type": "string"},
    "createdAt": {"type": "string", "pattern": "^\\d{4}-\\d{2}-\\d{2}$"},
    "scope": {"type": "string", "minLength": 1},
    "status": {"type": "string", "enum": ["proposal", "approved", "rejected", "merged"]},
    "brands": {
      "type": "array",
      "items": {
        "type": "object",
        "required": ["brandId", "brandName", "tier", "isEnabled"],
        "additionalProperties": false,
        "properties": {
          "brandId": {"type": "string", "pattern": "^[a-z0-9_]+$"},
          "brandName": {"type": "string", "minLength": 1},
          "tier": {"type": "string", "enum": ["S", "A", "B", "C", "D", "E", "Planned"]},
          "isEnabled": {"type": "boolean"}
        }
      }
    },
    "models": {
      "type": "array",
      "items": {
        "type": "object",
        "required": ["id", "brandId", "modelName", "category", "source"],
        "additionalProperties": false,
        "properties": {
          "id": {"type": "string", "pattern": "^[a-z0-9_]+$"},
          "brandId": {"type": "string", "pattern": "^[a-z0-9_]+$"},
          "modelName": {"type": "string", "minLength": 1},
          "category": {"type": "string"},
          "source": {"type": "string", "enum": ["master", "user_input"]}
        }
      }
    },
    "aliases": {
      "type": "array",
      "items": {
        "type": "object",
        "required": ["modelId", "alias"],
        "additionalProperties": false,
        "properties": {
          "modelId": {"type": "string", "pattern": "^[a-z0-9_]+$"},
          "alias": {"type": "string", "minLength": 1}
        }
      }
    },
    "searchKeywords": {
      "type": "array",
      "items": {
        "type": "object",
        "required": ["modelId", "keyword"],
        "additionalProperties": false,
        "properties": {
          "modelId": {"type": "string", "pattern": "^[a-z0-9_]+$"},
          "keyword": {"type": "string", "minLength": 1}
        }
      }
    },
    "audit": {
      "type": "object",
      "required": ["risk", "notes"],
      "additionalProperties": false,
      "properties": {
        "risk": {"type": "string", "enum": ["low", "medium", "high"]},
        "notes": {"type": "array", "items": {"type": "string"}}
      }
    }
  }
}
